{
  "$schema": "https://json-schema.org/draft/2020-12/schema",
  "$id": "https://usd-impact.com/schemas/score-v2-1f-bls-wpu0561-column-semantics-preflight-authorization.schema.json",
  "title": "Score v2.1F BLS WPU0561 column-semantics preflight authorization",
  "type": "object",
  "additionalProperties": false,
  "required": [
    "version",
    "decision_status",
    "methodology_version",
    "issue",
    "execution_scope",
    "data_window",
    "request_budget",
    "contact_user_agent",
    "allowed_host",
    "fixed_resources",
    "storage_policy",
    "authorizations",
    "approved_by",
    "approved_at",
    "notes"
  ],
  "properties": {
    "version": {"const": 1},
    "decision_status": {"enum": ["hold", "approved"]},
    "methodology_version": {"const": "2.1F-design-candidate"},
    "issue": {"const": "https://github.com/usdimpact/usd-impact-pipeline/issues/244"},
    "execution_scope": {"const": "bls_wpu0561_column_semantics_preflight_only"},
    "data_window": {
      "type": "object",
      "additionalProperties": false,
      "required": ["start", "end"],
      "properties": {
        "start": {"type": ["string", "null"], "format": "date"},
        "end": {"type": ["string", "null"], "format": "date"}
      }
    },
    "request_budget": {"const": 2},
    "contact_user_agent": {
      "type": ["string", "null"],
      "pattern": "^USD-Impact-Score-v2\\.1F-WPU0561-column-semantics/1\\.0 \\(contact: .+\\)$"
    },
    "allowed_host": {"const": "www.bls.gov"},
    "fixed_resources": {
      "const": [
        "/news.release/archives/ppi_05152013.htm",
        "/ppi/detailed-report/ppi-detailed-report-april-2026.xlsx"
      ]
    },
    "storage_policy": {
      "type": "object",
      "additionalProperties": false,
      "required": [
        "response_bodies",
        "economic_values",
        "identifier_only_numeric_field",
        "credentials",
        "durable_private_storage"
      ],
      "properties": {
        "response_bodies": {"const": "ephemeral_memory_only"},
        "economic_values": {"const": "do_not_extract_log_or_persist"},
        "identifier_only_numeric_field": {
          "const": "allowed_only_under_proven_identifier_header"
        },
        "credentials": {"const": "forbidden"},
        "durable_private_storage": {"const": false}
      }
    },
    "authorizations": {
      "type": "object",
      "additionalProperties": false,
      "required": [
        "response_body_ephemeral_retrieval",
        "column_semantics_preflight",
        "numeric_identifier_field_read",
        "economic_value_extraction",
        "real_data_research",
        "full_historical_reconstruction",
        "candidate_score_computation",
        "research_ledger_mutation",
        "public_artifact_replacement",
        "production"
      ],
      "properties": {
        "response_body_ephemeral_retrieval": {"type": "boolean"},
        "column_semantics_preflight": {"type": "boolean"},
        "numeric_identifier_field_read": {"type": "boolean"},
        "economic_value_extraction": {"const": false},
        "real_data_research": {"const": false},
        "full_historical_reconstruction": {"const": false},
        "candidate_score_computation": {"const": false},
        "research_ledger_mutation": {"const": false},
        "public_artifact_replacement": {"const": false},
        "production": {"const": false}
      }
    },
    "approved_by": {"type": ["string", "null"], "minLength": 1},
    "approved_at": {"type": ["string", "null"], "format": "date-time"},
    "notes": {"type": "string"}
  },
  "allOf": [
    {
      "if": {"properties": {"decision_status": {"const": "hold"}}},
      "then": {
        "properties": {
          "data_window": {
            "properties": {
              "start": {"const": null},
              "end": {"const": null}
            }
          },
          "contact_user_agent": {"const": null},
          "authorizations": {
            "properties": {
              "response_body_ephemeral_retrieval": {"const": false},
              "column_semantics_preflight": {"const": false},
              "numeric_identifier_field_read": {"const": false}
            }
          },
          "approved_by": {"const": null},
          "approved_at": {"const": null}
        }
      }
    },
    {
      "if": {"properties": {"decision_status": {"const": "approved"}}},
      "then": {
        "properties": {
          "data_window": {
            "properties": {
              "start": {"const": "2013-01-01"},
              "end": {"const": "2026-10-23"}
            }
          },
          "contact_user_agent": {"type": "string"},
          "authorizations": {
            "properties": {
              "response_body_ephemeral_retrieval": {"const": true},
              "column_semantics_preflight": {"const": true},
              "numeric_identifier_field_read": {"const": true}
            }
          },
          "approved_by": {"type": "string", "minLength": 1},
          "approved_at": {"type": "string", "format": "date-time"}
        }
      }
    }
  ]
}