{
  "version": 1,
  "decision_status": "approved",
  "methodology_version": "2.1F-design-candidate",
  "issue": "https://github.com/usdimpact/usd-impact-pipeline/issues/244",
  "execution_scope": "bls_wpu0561_column_semantics_preflight_only",
  "data_window": {
    "start": "2013-01-01",
    "end": "2026-10-23"
  },
  "request_budget": 2,
  "contact_user_agent": "USD-Impact-Score-v2.1F-WPU0561-column-semantics/1.0 (contact: support@usd-impact.com)",
  "allowed_host": "www.bls.gov",
  "fixed_resources": [
    "/news.release/archives/ppi_05152013.htm",
    "/ppi/detailed-report/ppi-detailed-report-april-2026.xlsx"
  ],
  "storage_policy": {
    "response_bodies": "ephemeral_memory_only",
    "economic_values": "do_not_extract_log_or_persist",
    "identifier_only_numeric_field": "allowed_only_under_proven_identifier_header",
    "credentials": "forbidden",
    "durable_private_storage": false
  },
  "authorizations": {
    "response_body_ephemeral_retrieval": true,
    "column_semantics_preflight": true,
    "numeric_identifier_field_read": true,
    "economic_value_extraction": false,
    "real_data_research": false,
    "full_historical_reconstruction": false,
    "candidate_score_computation": false,
    "research_ledger_mutation": false,
    "public_artifact_replacement": false,
    "production": false
  },
  "approved_by": "usdimpact owner via Issue #244 approval comment 6482193778",
  "approved_at": "2026-10-28T22:23:21Z",
  "notes": "Owner-approved column-semantics preflight only. Numeric-looking identifier cells may be read only under a proven non-numeric identifier header. Economic index levels and percent-change values remain forbidden. Activation only; dispatch remains separate."
}